schemeName,ministryName,description,benefits,eligibility,howToApply,schemeId,status,lastUpdated
PM-KISAN (Pradhan Mantri Kisan Samman Nidhi),Ministry of Agriculture and Farmers Welfare,Direct income support of Rs. 6000 per year to eligible farmer families,Rs. 6000 per year in three equal installments,Small and marginal farmers with cultivable land up to 2 hectares,Apply through Common Service Centres or online portal,PMKISAN001,Active,2024-01-01
PM Fasal Bima Yojana (PMFBY),Ministry of Agriculture and Farmers Welfare,Crop insurance scheme to protect farmers against crop losses,Comprehensive crop insurance coverage with low premium,All farmers growing notified crops,Contact nearest bank or insurance company,PMFBY001,Active,2024-01-01
Kisan Credit Card (KCC),Ministry of Agriculture and Farmers Welfare,Credit card for farmers to meet agricultural needs,"Easy credit access, low interest rates, flexible repayment","Individual farmers, tenant farmers, sharecroppers",Apply through nearest bank branch,KCC001,Active,2024-01-01
Soil Health Card Scheme,Ministry of Agriculture and Farmers Welfare,Provides soil health cards to farmers every 3 years,"Free soil testing, nutrient recommendations, improved crop yield",All farmers across India,Contact nearest Krishi Vigyan Kendra or agriculture office,SHC001,Active,2024-01-01
PMKSY (Pradhan Mantri Krishi Sinchayee Yojana),Ministry of Agriculture and Farmers Welfare,Har Khet Ko Paani - Water to every field,"Irrigation infrastructure, water conservation, drought management",Farmers in water-scarce areas,Contact state agriculture department,PMKSY001,Active,2024-01-01
National Agriculture Market (eNAM),Ministry of Agriculture and Farmers Welfare,Online trading platform for agricultural commodities,"Better price discovery, transparent trading, reduced middlemen",All farmers and traders,Register on eNAM portal,ENAM001,Active,2024-01-01
PM-FME (Pradhan Mantri Formalisation of Micro Food Processing Enterprises),Ministry of Food Processing Industries,Support for micro food processing enterprises,"Financial assistance, technical support, capacity building",Micro food processing enterprises,Apply through state implementing agencies,PMFME001,Active,2024-01-01
National Mission for Sustainable Agriculture (NMSA),Ministry of Agriculture and Farmers Welfare,Promotes sustainable agriculture practices,"Climate-resilient farming, soil health improvement",Farmers practicing sustainable agriculture,Contact state agriculture department,NMSA001,Active,2024-01-01
